{
  "schema_version": "1.0",
  "document_id": "EVAL-BUILD-CONTRACT",
  "title": "Build Contract: EVAL-001 Evidence Observatory",
  "output_markdown": "BUILD_CONTRACT.md",
  "canonical_format": "json",
  "last_generated_utc": "2026-04-15T23:39:35.100679Z",
  "body_markdown": "# Build Contract: EVAL-001 Evidence Observatory\n\n## 1. Current State (Honest)\n\n`projects/evaluation/` contains the evaluation package (`tlc_evals/`), dataset artifacts (`datasets/`), evaluation specifications (`eval_specs/`), and supporting documentation (`README.md`, `evidence_summary.md`, `failure_taxonomy.md`, `pattern_analysis.md`, `pyproject.toml`).\n\n`projects/evaluation/verification/` now contains full-cycle EVAL-001 evidence artifacts, including phase checkpoints, evaluation results, recurrence analysis, and CI signal output.\n\n## 2. Target State (What This Contract Enables)\n\nEVAL-001 operates as the constitutional Evidence Observatory for machine-verifiable failure analysis, invariant linkage verification, schema validation, recurrence detection, and CI emission.\n\n## 3. Scope\n\nThis contract governs:\n\n1. Topology validation for `projects/evaluation/` assets\n2. Eval spec loading and implementation parity checks\n3. Dataset schema/integrity validation\n4. Evaluation execution with provenance and metric outputs\n5. Historical recurrence detection\n6. CI signal emission and constitutional compliance bit generation\n7. Evidence schema and hash-chain integrity validation\n\nOut of scope:\n\n- Modifying constitutional root artifacts\n- Mutating `projects/c-rsp/invariant_registry.json`\n- External network-dependent evaluation workflows\n\n## 4. Acceptance Criteria\n\n- AC-001: Bootstrap verification returns PASS with JSON evidence\n- AC-002: Asset topology validates all critical assets present\n- AC-003: Suite configuration validates all specifications\n- AC-004: Dataset validation processes all datasets\n- AC-005: Evaluation execution completes within constraints\n- AC-006: Recurrence detection classifies all failures\n- AC-007: CI emission outputs valid signal\n- AC-008: Evidence schema validation passes and hash chain is intact\n- AC-009: BUILD_CONTRACT hash is referenced by evidence\n- AC-010: No halt conditions are triggered in full cycle\n\n## 5. Asset Inventory\n\nRequired assets:\n\n- `projects/evaluation/datasets/failure_cases.json`\n- `projects/evaluation/eval_specs/invariant_suite.yaml`\n- `projects/evaluation/eval_specs/f2_phantom_completion.yaml`\n- `projects/evaluation/tlc_evals/` (all subpackages)\n- `projects/evaluation/pyproject.toml`\n- `projects/evaluation/README.md`\n- `projects/evaluation/evidence_summary.md`\n- `projects/evaluation/failure_taxonomy.md`\n- `projects/evaluation/pattern_analysis.md`\n\n## 6. Evidence Required\n\nPer execution, produce:\n\n1. `verification/crsp_EVAL-001_log.json`\n2. `verification/topology_validation_*.json`\n3. `verification/suite_config_*.json`\n4. `verification/dataset_validation_*.json`\n5. `verification/eval_results_*.json`\n6. `verification/recurrence_analysis_*.json`\n7. `verification/ci_signal_*.json`\n\nAll evidence must validate against `projects/c-rsp/schemas/evidence_schema.json`.\n\n## 7. Entry Protocol\n\nEntry order is mandatory:\n\n1. Run `python3 src/guardian.py --health-check` (Phase 0)\n2. Validate topology (Phase 1)\n3. Validate suite configuration (Phase 2)\n4. Validate dataset(s) (Phase 3)\n5. Execute evaluations (Phase 4)\n6. Run recurrence detection (Phase 5)\n7. Emit CI signal (Phase 6)\n\nNo phase skipping is permitted.\n\n## 8. Implementation Spec\n\n- Enforce sequential phase execution 0 -> 6\n- Checkpoint after each phase into `verification/checkpoint_phase{N}_*.json`\n- Use append-only writes for `verification/`\n- Enforce evaluation sandbox constraints:\n  - 300s timeout per evaluation\n  - 4GB memory cap per process\n  - no network access\n  - read-only `datasets/`, write-only `verification/`\n- Compute evidence hash chain via `previous_hash`\n- Include BUILD-EVAL-001 source hash in all evidence\n\nExecution modes:\n\n- `FULL_CYCLE`: phases 0-6\n- `VALIDATION_ONLY`: phases 0-3\n- `RECURRENCE_SCAN`: phases 0,1,2,5\n- `RECOVERY_MODE`: resume from last valid checkpoint\n\n## 9. Halt Conditions\n\nHALT on:\n\n- Missing critical assets (`datasets/`, `eval_specs/`, `tlc_evals/`, required docs)\n- Spec/implementation drift between eval specs and `tlc_evals/evals/`\n- Invariant corruption or load failure\n- Sandbox violation or determinism failure\n- Evidence write failure\n- Runtime over 3600 seconds for full cycle\n- Use of stale checkpoints older than 7 days\n\nEscalation path: `projects/c-rsp/RECOVERY_PROTOCOL.md`.\n"
}
